{
  "schema_version": 1,
  "report_version": "1.0.0",
  "evaluation_instant": "2026-08-07T12:00:00+00:00",
  "result": "compliant",
  "constitution_version": "1.0.0",
  "architecture_version": "1.2.0",
  "summary": {"passed": 1, "failed": 0, "excepted": 0, "indeterminate": 0},
  "active_exception_ids": [],
  "controls": [{
    "id": "control.synthetic",
    "title": "Synthetic control",
    "severity": "error",
    "status": "passed",
    "source_ids": ["synthetic.source"],
    "finding_ids": [],
    "exception_ids": []
  }],
  "findings": []
}
